{
  "lease_id": "lease-0001-held",
  "principal_chain": [
    "agent:runner-dispatch-01",
    "user:gustavo"
  ],
  "path_set": [
    "/tmp/hugit/run/abc123",
    "/cache/hugit/toolchains"
  ],
  "expiry": 1717003600000,
  "net_policy": "egress-deny-all",
  "tmp_root": "/tmp/hugit/run/abc123",
  "state": "held"
}
